{
  "schemaVersion": 1,
  "states": [
    {"id": "specified", "label": "指定", "number": 1},
    {"id": "delegated", "label": "お任せ", "number": 2},
    {"id": "defaulted", "label": "既定値", "number": 3},
    {"id": "toolManaged", "label": "ツール任せ", "number": 4}
  ],
  "groups": [
    {"id": "purpose-context", "axis": "A", "label": "用途・文脈", "order": 10},
    {"id": "genre-style", "axis": "B", "label": "ジャンル・様式", "order": 20},
    {"id": "mood-tone", "axis": "C", "label": "情緒・雰囲気", "order": 30},
    {"id": "sound", "axis": "D", "label": "音の構成", "order": 40},
    {"id": "time", "axis": "E", "label": "時間的な構造", "order": 50},
    {"id": "production", "axis": "F", "label": "制作・質感", "order": 60},
    {"id": "lyrics", "axis": "G", "label": "歌詞", "order": 65},
    {"id": "exclusion", "axis": null, "label": "除外", "order": 70},
    {"id": "notes", "axis": null, "label": "自由記述", "order": 80}
  ],
  "fields": [
    {
      "id": "purpose", "label": "用途", "group": "purpose-context", "kind": "select", "vocabulary": "usage", "freeText": true,
      "specificity": "expand", "initialState": "delegated",
      "states": {
        "specified": {},
        "delegated": {"rule": "derive", "cues": ["*"], "fallback": {"type": "text", "text": "特定の用途を想定しない楽曲"}}
      },
      "note": "他の項目全体から逆算する。最終的な拠り所（`request-text.md` B-02 の 2-1）"
    },
    {
      "id": "purposeDetail", "label": "用途の詳細", "group": "purpose-context", "kind": "text", "freeText": false,
      "specificity": "expand", "initialState": "delegated",
      "states": {
        "specified": {},
        "delegated": {"rule": "derive", "cues": ["purpose"], "fallback": {"type": "omit"}}
      },
      "note": "用途から自然に導ける範囲。用途が②お任せなら詳細も②（crossFieldRules）"
    },
    {
      "id": "listeningEnvironment", "label": "想定する聴取環境", "group": "purpose-context", "kind": "select", "vocabulary": "listening-environment", "freeText": false,
      "leaveValues": ["no-playback"],
      "specificity": "adapt", "initialState": "delegated",
      "states": {
        "specified": {},
        "delegated": {"rule": "derive", "cues": ["purpose"], "fallback": {"type": "omit"}}
      },
      "note": "③は持たない（既定値が未定義だったため。判断ポイント11）。導かせたくないときは値 `no-playback` を指定する"
    },
    {
      "id": "mainGenre", "label": "主ジャンル", "group": "genre-style", "kind": "select", "vocabulary": "genre", "freeText": true,
      "specificity": "adapt", "initialState": "delegated",
      "states": {
        "specified": {},
        "delegated": {"rule": "derive", "cues": ["purpose", "mood"], "fallback": {"type": "choose"}}
      },
      "note": "最も一般的なものを選ぶ。単一選択（除外の概念がない）"
    },
    {
      "id": "subGenres", "label": "副ジャンル", "group": "genre-style", "kind": "triSelect", "vocabulary": "genre", "freeText": true,
      "specificity": "adapt", "initialState": "delegated",
      "states": {
        "specified": {},
        "delegated": {"rule": "leave"}
      },
      "note": "②は足さない（RP-11）。主ジャンルと語彙を共有する（`presets.md` 判断ポイント13）"
    },
    {
      "id": "regionStyles", "label": "地域・文化の様式", "group": "genre-style", "kind": "triSelect", "vocabulary": "region-style", "freeText": true,
      "specificity": "expand", "initialState": "delegated",
      "states": {
        "specified": {},
        "delegated": {"rule": "leave"}
      },
      "note": "②は足さない（RP-11）。拡張した内容は音の構成（軸D）に書く（RP-10）"
    },
    {
      "id": "styleLean", "label": "様式の寄せ方", "group": "genre-style", "kind": "select", "vocabulary": "style-lean", "freeText": false,
      "specificity": "adapt", "initialState": "defaulted",
      "states": {
        "specified": {},
        "delegated": {"rule": "derive", "cues": ["purpose", "mainGenre"], "fallback": {"type": "value", "value": "style"}},
        "defaulted": {"value": "style"}
      },
      "note": "地域・文化の様式に「使用する」があるときだけ意味を持つ（crossFieldRules）"
    },
    {
      "id": "era", "label": "年代・時代感", "group": "genre-style", "kind": "select", "vocabulary": "era", "freeText": true,
      "leaveValues": ["no-era"],
      "specificity": "adapt", "initialState": "delegated",
      "states": {
        "specified": {},
        "delegated": {"rule": "derive", "cues": ["mainGenre"], "fallback": {"type": "omit"}}
      },
      "note": "導かせたくないときは値 `no-era` を指定する（判断ポイント9）。自由記述は 2026-10-28 から（例: 昭和50年代。判断ポイント29）"
    },
    {
      "id": "mood", "label": "基調となる情緒", "group": "mood-tone", "kind": "triSelect", "vocabulary": "emotion", "freeText": true,
      "specificity": "expand", "initialState": "delegated",
      "states": {
        "specified": {},
        "delegated": {"rule": "derive", "cues": ["purpose", "mainGenre"], "fallback": {"type": "choose"}}
      }
    },
    {
      "id": "intensity", "label": "強度", "group": "mood-tone", "kind": "select", "vocabulary": "intensity", "freeText": false,
      "specificity": "adapt", "initialState": "delegated",
      "states": {
        "specified": {},
        "delegated": {"rule": "derive", "cues": [], "fallback": {"type": "value", "value": "medium"}},
        "defaulted": {"value": "medium"}
      },
      "note": "②は手がかりを持たず、フォールバックの中程度を使う（`input-items.md` 「②なら中程度」）"
    },
    {
      "id": "brightness", "label": "明暗", "group": "mood-tone", "kind": "select", "vocabulary": "brightness", "freeText": false,
      "specificity": "adapt", "initialState": "delegated",
      "states": {
        "specified": {},
        "delegated": {"rule": "derive", "cues": ["mood"], "fallback": {"type": "value", "value": "neutral"}},
        "defaulted": {"value": "neutral"}
      }
    },
    {
      "id": "leadInstruments", "label": "主旋律を担う楽器", "group": "sound", "kind": "triSelect", "vocabulary": "instrument", "freeText": true,
      "specificity": "expand", "initialState": "delegated",
      "states": {
        "specified": {},
        "delegated": {"rule": "derive", "cues": ["mainGenre", "regionStyles"], "fallback": {"type": "choose"}}
      },
      "note": "楽器の語彙を伴奏・リズムと共有する。除外は3項目で連動する（crossFieldRules）"
    },
    {
      "id": "accompanimentInstruments", "label": "伴奏・支える楽器", "group": "sound", "kind": "triSelect", "vocabulary": "instrument", "freeText": true,
      "specificity": "expand", "initialState": "delegated",
      "states": {
        "specified": {},
        "delegated": {"rule": "derive", "cues": ["leadInstruments", "ensembleSize"], "fallback": {"type": "choose"}}
      }
    },
    {
      "id": "rhythmInstruments", "label": "リズムの担い手", "group": "sound", "kind": "triSelect", "vocabulary": "instrument", "freeText": true,
      "specificity": "expand", "initialState": "delegated",
      "states": {
        "specified": {},
        "delegated": {"rule": "derive", "cues": ["mainGenre", "tempoFeel"], "fallback": {"type": "choose"}}
      }
    },
    {
      "id": "voiceTreatment", "label": "声の扱い", "group": "sound", "kind": "select", "vocabulary": "voice-treatment", "freeText": false,
      "leaveValues": ["no-voice"],
      "specificity": "keep", "initialState": "defaulted",
      "states": {
        "specified": {},
        "delegated": {"rule": "derive", "cues": ["mainGenre", "mood"], "fallback": {"type": "value", "value": "no-voice"}},
        "defaulted": {"value": "no-voice"}
      },
      "note": "②はAIが決めてよい（歌詞のない形に限る。判断ポイント9）。手がかりとフォールバックは、定義がなかったため補完した。歌ありでも有効（2026-09-28。L-01。`input-items.md` 判断ポイント27）"
    },
    {
      "id": "ensembleSize", "label": "編成の規模", "group": "sound", "kind": "select", "vocabulary": "ensemble-size", "freeText": false,
      "specificity": "adapt", "initialState": "delegated",
      "states": {
        "specified": {},
        "delegated": {"rule": "derive", "cues": ["purpose", "mainGenre"], "fallback": {"type": "value", "value": "small-ensemble"}},
        "defaulted": {"value": "small-ensemble"}
      }
    },
    {
      "id": "length", "label": "長さ", "group": "time", "kind": "length", "freeText": false,
      "specificity": "uiSetting", "initialState": "toolManaged",
      "states": {
        "specified": {},
        "toolManaged": {"note": "特定の長さを前提にした構成を書かせない（RP-02 の④）"}
      },
      "rangeFrom": {"param": "length"},
      "note": "範囲は、ツールプロファイルのパラメータ length が持つ（tool-profile.md §9）"
    },
    {
      "id": "tempoFeel", "label": "テンポ感", "group": "time", "kind": "select", "vocabulary": "tempo-feel", "freeText": false,
      "specificity": "adapt", "initialState": "delegated",
      "states": {
        "specified": {},
        "delegated": {"rule": "derive", "cues": ["mainGenre", "mood"], "fallback": {"type": "choose"}}
      },
      "note": "BPM と両方指定されたときは BPM を優先する（`input-items.md` 判断ポイント2）"
    },
    {
      "id": "bpm", "label": "BPM の目安", "group": "time", "kind": "bpm", "freeText": false,
      "specificity": "keep", "initialState": "delegated",
      "states": {
        "specified": {},
        "delegated": {"rule": "leave"}
      },
      "note": "単一値または範囲（判断ポイント8）。③は持たない（②が「足さない」のため。判断ポイント11）"
    },
    {
      "id": "developmentShape", "label": "展開の形", "group": "time", "kind": "select", "vocabulary": "development-shape", "freeText": true,
      "specificity": "expand", "initialState": "delegated",
      "states": {
        "specified": {},
        "delegated": {"rule": "derive", "cues": ["purpose"], "fallback": {"type": "choose"}}
      },
      "note": "ループ用途なら「一定を保つ」寄り"
    },
    {
      "id": "structure", "label": "構成（セクションの並び）", "group": "time", "kind": "sectionList", "vocabulary": "section", "freeText": false,
      "specificity": "keep", "initialState": "delegated",
      "states": {
        "specified": {},
        "delegated": {"rule": "leave"}
      },
      "note": "③は持たない（判断ポイント11）。並び替え可能なリスト。歌あり（`vocalMode` = `vocal`）のときは無効（`lyricsStructure` を使う。`song.schema.json` 側で制御。2026-09-28。L-01）"
    },
    {
      "id": "lyricsTheme", "label": "歌詞のテーマ・内容", "group": "lyrics", "kind": "text", "freeText": false,
      "specificity": "expand", "initialState": "delegated",
      "states": {
        "specified": {},
        "delegated": {"rule": "derive", "cues": ["purpose"], "fallback": {"type": "omit"}}
      },